{"$schema": "http://json-schema.org/schema#", "type": "object", "properties": {"descriptions": {"type": "array", "items": {"type": "object", "properties": {"description": {"type": "string"}, "language": {"type": "object", "properties": {"name": {"type": "string"}, "url": {"type": "string"}}, "required": ["name", "url"]}}, "required": ["description", "language"]}}, "gene_modulo": {"type": "integer"}, "highest_stat": {"type": "object", "properties": {"name": {"type": "string"}, "url": {"type": "string"}}, "required": ["name", "url"]}, "id": {"type": "integer"}, "possible_values": {"type": "array", "items": {"type": "integer"}}}, "required": ["descriptions", "gene_modulo", "highest_stat", "id", "possible_values"]}
