{
    "descriptions": [
        {
            "description": "Aime se d\u00e9mener",
            "language": {
                "name": "fr",
                "url": "https://pokeapi.co/api/v2/language/5/"
            }
        },
        {
            "description": "Le gusta revolverse",
            "language": {
                "name": "es",
                "url": "https://pokeapi.co/api/v2/language/7/"
            }
        },
        {
            "description": "Likes to thrash about",
            "language": {
                "name": "en",
                "url": "https://pokeapi.co/api/v2/language/9/"
            }
        }
    ],
    "gene_modulo": 1,
    "highest_stat": {
        "name": "attack",
        "url": "https://pokeapi.co/api/v2/stat/2/"
    },
    "id": 8,
    "possible_values": [
        1,
        6,
        11,
        16,
        21,
        26,
        31
    ]
}