{
    "descriptions": [
        {
            "description": "Attentif aux sons",
            "language": {
                "name": "fr",
                "url": "https://pokeapi.co/api/v2/language/5/"
            }
        },
        {
            "description": "Siempre tiene el o\u00eddo alerta",
            "language": {
                "name": "es",
                "url": "https://pokeapi.co/api/v2/language/7/"
            }
        },
        {
            "description": "Alert to sounds",
            "language": {
                "name": "en",
                "url": "https://pokeapi.co/api/v2/language/9/"
            }
        }
    ],
    "gene_modulo": 1,
    "highest_stat": {
        "name": "speed",
        "url": "https://pokeapi.co/api/v2/stat/6/"
    },
    "id": 12,
    "possible_values": [
        1,
        6,
        11,
        16,
        21,
        26,
        31
    ]
}